name,url,subscribers,description,created_utc,is_active,keyword,last_updated
APStudents,https://www.reddit.com/r/APStudents/,336137.0,"No matter what course you are taking, we are a community that helps students earn college credit!",2013-08-20,True,college students,2025-05-10
army,https://www.reddit.com/r/army/,327711.0,United States Army on Reddit,2009-02-24,True,professional development,2025-05-10
BudgetAudiophile,https://www.reddit.com/r/BudgetAudiophile/,308527.0,"This subreddit is for the budget minded audiophile that wants to grow out of soundbars, boomboxes, mini systems, portable bluetooth, lifestyle speakers, and PC peripheral branded audio solutions. 

We focus on education, discussion, and sharing of entry and mid level separate & multi component audio systems.

The only bad audio system, is the one you don't enjoy to the fullest.",2014-01-28,True,entry level jobs,2025-05-10
gradadmissions,https://www.reddit.com/r/gradadmissions/,303960.0,"This subreddit is for anyone who is going through the process of getting into graduate school, and for those who've been there and have advice to give.",2012-02-28,True,university,2025-05-10
UKJobs,https://www.reddit.com/r/UKJobs/,298546.0,"A community intended to provide a place for users wanting to ask questions or create discussions, all related to the UK and jobs within the UK.

Make sure to read the rules before posting or commenting. It is an assumption that by posting on this subreddit you already have a right to work in the UK, if not, there are better subreddits/websites for that information.",2011-03-27,True,job hunting,2025-05-10
leetcode,https://www.reddit.com/r/leetcode/,296647.0,Discuss interview prep strategies and leetcode questions,2017-07-08,True,new grads,2025-05-10
Slovakia,https://www.reddit.com/r/Slovakia/,287938.0,"Do you want to discuss something with Slovaks or people living in Slovakia? You are at the right place.


Come and also join our Discord server:

https://discord.gg/bAK9HGDw",2009-05-14,True,entry level jobs,2025-05-10
delhiuniversity,https://www.reddit.com/r/delhiuniversity/,285836.0,A reddit page for the most vibrant university in India.,2016-08-10,True,university,2025-05-10
ExperiencedDevs,https://www.reddit.com/r/ExperiencedDevs/,283101.0,"For experienced developers. This community should be specialized subreddit facilitating discussion amongst individuals who have gained some ground in the software engineering world. 

Any posts or comments that are made by inexperienced individuals (outside of the weekly Ask thread) should be reported.

Anything not specifically related to development or career advice that is _specific_ to Experienced Developers belongs elsewhere. Try /r/work, /r/AskHR, /r/careerguidance, or /r/OfficePolitics.",2018-01-22,True,career advice,2025-05-10
MBA,https://www.reddit.com/r/MBA/,282615.0,"Learn about MBA programs, applying to them, and what life is like while in one and afterwards. 

Please make sure to read our rules and wiki before posting.",2009-10-30,True,college students,2025-05-10
SGExams,https://www.reddit.com/r/SGExams/,281688.0,"Wᴇʟᴄᴏᴍᴇ ᴛᴏ ʀ/SGExᴀᴍs – the largest community on reddit discussing education and student life in Singapore!

SGExams is also more than a subreddit - we're a registered nonprofit that organises initiatives supporting students' academics, career guidance, mental health and holistic development, such as webinars and mentorship programmes. Interested in our programmes? Follow us on Instagram (instagram.com/sgexams) or look out for the pinned posts on the subreddit for updates! © Esᴛᴀʙʟɪsʜᴇᴅ MMXVII",2017-10-26,True,internships,2025-05-10
learnjavascript,https://www.reddit.com/r/learnjavascript/,278194.0,"This subreddit is for anyone who wants to learn JavaScript or help others do so. 

Questions and posts about frontend development in general are welcome, as are all posts pertaining to JavaScript on the backend.",2012-04-04,True,coding bootcamp,2025-05-10
PinoyProgrammer,https://www.reddit.com/r/PinoyProgrammer/,275863.0,"Community of Pinoy programmers to share ideas, projects, job vacancies and socialize with fellow programmers.",2014-09-08,True,coding bootcamp,2025-05-10
askTO,https://www.reddit.com/r/askTO/,272697.0,A subreddit for people to submit questions to Torontonians and about Toronto and receive constructive responses.,2013-06-13,True,coding bootcamp,2025-05-10
CompTIA,https://www.reddit.com/r/CompTIA/,265862.0,"From the ""looking to get certified,"" to conversations/questions from current students, to certified and working professionals - this subreddit is dedicated to CompTIA certifications. It is not owned, moderated or sponsored in any way by CompTIA.",2011-06-16,True,entry level jobs,2025-05-10
Btechtards,https://www.reddit.com/r/Btechtards/,254690.0,"A community for BTech and Engineering students, aspirants & STEM enthusiasts. From serious discussions, advice-guidance, suggestions to shitposts.",2021-10-17,True,internships,2025-05-10
androiddev,https://www.reddit.com/r/androiddev/,252648.0,"News for Android developers with the who, what, where, when and how of the Android community. 

News / Articles / Talks / Tools / Open source!",2009-07-12,True,professional development,2025-05-10
jobsearchhacks,https://www.reddit.com/r/jobsearchhacks/,243864.0,"Forget traditional job searching - improve your odds with good tips, tricks and tactics that help you stand out.",2012-05-01,True,job hunting,2025-05-10
UniUK,https://www.reddit.com/r/UniUK/,243806.0,"Got a question about going to uni in the UK? Want to find out more and speak to others about their course/uni? Not sure if you can eat something that's been loafing in your fridge for 3 weeks, and gone a dubious shade of purple-green? This is the place for you.                  



If you want to post a survey for your dissertation, please make sure your post includes all information required by the rules linked in our wiki!",2016-02-29,True,university,2025-05-10
Indian_Academia,https://www.reddit.com/r/Indian_Academia/,236288.0,"
A subreddit for discussions about Indian higher education, research, admissions process, career advice, resource sharing, and similar topics.",2018-04-22,True,career advice,2025-05-10
ClashOfClansRecruit,https://www.reddit.com/r/ClashOfClansRecruit/,235268.0,Want to advertise your Clash Of Clans clan? Looking for a new clan? Post it here!,2014-02-23,True,entry level jobs,2025-05-10
SampleSize,https://www.reddit.com/r/SampleSize/,235206.0,"A place for surveys and polls to be posted. Research studies for school purposes are welcome as well as opinion polls

We are also a place for people who enjoy responding to surveys to gather and help people obtain responses for their research.

Questions about a mild level of statistics or wording of surveys are also permitted.",2012-02-21,True,college students,2025-05-10
IndiaCareers,https://www.reddit.com/r/IndiaCareers/,212096.0,"Welcome to IndiaCareers, your go-to hub for career advice, job opportunities, and professional growth in India! Whether you're a fresh graduate, an experienced professional, or looking to make a career switch, our community offers support, resources, and discussions on various industries, resume building, interview tips, career advancement, and more. Join us to connect with like-minded individuals, share your experiences, and find guidance to achieve your career goals in India!






",2015-10-26,True,career advice,2025-05-10
ECE,https://www.reddit.com/r/ECE/,211147.0,A subreddit for discussion of all things electrical and computer engineering.,2009-07-20,True,internships,2025-05-10
education,https://www.reddit.com/r/education/,210485.0,"The goal of r/Education is to provide a community in which educational stakeholders can participate in meaningful, reflective, and thought-provoking discourse about educational policy, research, technology, and politics. Additional Keywords, teachers, students, education",2008-03-21,True,college students,2025-05-10
Studium,https://www.reddit.com/r/Studium/,208938.0,Die deutschsprachige Community rund um das Studium.,2013-04-10,True,college students,2025-05-10
MechanicalEngineering,https://www.reddit.com/r/MechanicalEngineering/,194552.0,"The gathering place for mechanical engineers to discuss current technology, methods, jobs, and anything else related to mechanical engineering.",2010-12-28,True,entry level jobs,2025-05-10
projectmanagement,https://www.reddit.com/r/projectmanagement/,187473.0,"This is a safe and open environment dedicated to the promotion of project management methodologies, with the purpose of fostering and promoting free discussion about all things project management.

Check out r/PMcareers for career related posts.",2009-09-03,True,career advice,2025-05-10
longisland,https://www.reddit.com/r/longisland/,180169.0,Fuck /u/spez,2008-07-16,True,job hunting,2025-05-10
biotech,https://www.reddit.com/r/biotech/,180036.0,"News about any technological application that uses biological systems, living organisms, or derivatives thereof, to make or modify products or processes for specific use. | Or we can talk about career advice. Whatever.",2009-05-14,True,career advice,2025-05-10
pharmacy,https://www.reddit.com/r/pharmacy/,179704.0,"A subreddit for pharmacists, pharmacy students, techs, and anyone else in the pharmaceutical industry.",2008-07-01,True,new grads,2025-05-10
StudentNurse,https://www.reddit.com/r/StudentNurse/,174772.0,Practically anything and everything related to nursing school.,2012-12-09,True,new grads,2025-05-10
Beatmatch,https://www.reddit.com/r/Beatmatch/,174483.0,"Beginner/entry-level DJing - troubleshooting, you advice, question/answer, etc.",2011-10-08,True,entry level jobs,2025-05-10
civilengineering,https://www.reddit.com/r/civilengineering/,173954.0,A community dedicated to Civil Engineers and those aspiring to be. Please read the rules before participating.,2008-11-07,True,career advice,2025-05-10
humanresources,https://www.reddit.com/r/humanresources/,168036.0,"A subreddit for Human Resources professionals: come here to seek career advice, ask questions and get feedback from peers within the HR Community around the world whether you're brand new to HR or a seasoned vet.",2008-05-29,True,professional development,2025-05-10
SuggestALaptop,https://www.reddit.com/r/SuggestALaptop/,167846.0,A place for prospective laptop buyers to get suggestions from people who know the intimate details of the hardware. Please use the laptop form while posting a new request: bit.ly/3cIzaWC,2010-09-27,True,college students,2025-05-10
psychologystudents,https://www.reddit.com/r/psychologystudents/,162828.0,"We are a place for students of psychology to discuss study methods, receive assistance with homework, enquire for job-searching advice, and all else that come to mind.

This community is aimed at those at the beginner to intermediate level, generally in or around undergraduate studies. Graduate students and professionals are recommended to our sister subreddit, r/AcademicPsychology.",2012-11-10,True,grad school,2025-05-10
AcademicPsychology,https://www.reddit.com/r/AcademicPsychology/,162631.0,"A place to share and discuss articles/issues related to all fields of psychology. Discussions should be of an academic nature, avoiding ‘pop psychology.’ This is also a place to talk about your own psychology research, methods, and career in order to gain input from our vast psychology community.
This subreddit is generally aimed at those in an intermediate to master level, mostly in/around graduate school, or for professionals; undergraduates, etc., are recommended for r/psychologystudents.",2011-07-01,True,grad school,2025-05-10
dataanalysis,https://www.reddit.com/r/dataanalysis/,162548.0,"This is a place to discuss and post about data analysis.

Rules:

- Career-focused questions belong in r/DataAnalysisCareers
- Comments should remain civil and courteous.
- All reddit-wide rules apply here.
- Do not post personal information.
- No facebook or social media links.
- Do not spam.
- No 3rd party URL shorteners",2014-07-29,True,entry level jobs,2025-05-10
berkeley,https://www.reddit.com/r/berkeley/,160718.0,"A subreddit for the community of UC Berkeley as well as the surrounding City of Berkeley, California.",2008-02-27,True,students,2025-05-10
Liverpool,https://www.reddit.com/r/Liverpool/,158096.0,"Culture, events and general chat about the City of Liverpool and its region. Promotion of Liverpool-related businesses or events is allowed.",2009-07-10,True,coding bootcamp,2025-05-10
Professors,https://www.reddit.com/r/Professors/,157423.0,"This sub is for discussions amongst college & university faculty. Whether you are an adjunct, a lecturer, a grad TA or tenured stream if you teach students at the college level, this space is for you! While we welcome students and non-academics lurking and learning, posts and comments are not allowed. If you're new here, please familiarize yourself with the sub rules and follow them. If you're ever unsure, feel free to reach out to the moderators for clarification.",2011-09-14,True,college students,2025-05-10
teaching,https://www.reddit.com/r/teaching/,157268.0,,2009-05-14,True,professional development,2025-05-10
editors,https://www.reddit.com/r/editors/,155498.0,"This subreddit is geared towards post-professionals. 

Are you trying to become a pro? Feel free to use our ""ASK a PRO"" thread. 

Side hustle? Use the ""Ask a Pro"" thread.

Hobby? For fun? Our sister sub r/videoediting is what you want!",2008-12-07,True,career advice,2025-05-10
Veterans,https://www.reddit.com/r/Veterans/,155034.0,"This is a subreddit for news, information and events that may interest veterans of any nation. 

We are here to support one another, and help resolve any Veteran’s related issues for both veterans and their dependents.

If you are visiting r/veterans for the first time please read the rules.

If you need help: 
Veteran Crisis Hotline   Dial 988 Press 1 Call or Text or Chat",2009-11-10,True,coding bootcamp,2025-05-10
Neuropsychology,https://www.reddit.com/r/Neuropsychology/,154703.0,"Neuropsychology is both an experimental and clinical branch of psychology that aims to understand how cognitive functions (memory, attention, etc.) and behavior are related to brain structure and functioning. Although the focus is typically on how injuries or illnesses of the brain (i.e., pathological functions) affect cognition and behavior, it also includes the study normal (i.e., non-pathological) functioning, cognition, and behavior. ",2010-02-03,True,professional development,2025-05-10
6thForm,https://www.reddit.com/r/6thForm/,148330.0,"A place for sixth formers to speak to others about work, A-levels, results, problems in education and general sixth form life, as well as university applications and UCAS.",2013-08-27,True,university,2025-05-10
WGU,https://www.reddit.com/r/WGU/,146910.0,"Place for Western Governors University students, faculty and alumni to offer positive discussions and positive support for each other.",2011-03-25,True,university,2025-05-10
IndustrialDesign,https://www.reddit.com/r/IndustrialDesign/,144956.0,"A community for Industrial Design students and professionals. Discussing projects, school advice, sketches, portfolios and career help.",2008-06-15,True,career advice,2025-05-10
cscareerquestionsEU,https://www.reddit.com/r/cscareerquestionsEU/,144587.0,A subreddit for those with questions about computer science & IT careers within Europe,2017-02-20,True,internships,2025-05-10
Dentistry,https://www.reddit.com/r/Dentistry/,144354.0,"Discussions and links of interest for dental professionals on all things dentistry. 

Questions and stories from patients should be redirected to r/askdentists.",2010-04-25,True,new grads,2025-05-10
publichealth,https://www.reddit.com/r/publichealth/,142927.0,"This community is a space for public health professionals to discuss news, trends, new research, and updates in the field.",2009-10-06,True,career advice,2025-05-10
AskComputerScience,https://www.reddit.com/r/AskComputerScience/,138807.0,Ask Computer Science Questions And Get Answers!  This subreddit is intended for questions about topics that might be taught by a computer science department at a university.,2011-05-11,True,coding bootcamp,2025-05-10
quant,https://www.reddit.com/r/quant/,135404.0,"A subreddit for the quantitative finance: discussions, resources and research.",2008-07-08,True,career advice,2025-05-10
BlueArchive,https://www.reddit.com/r/BlueArchive/,134856.0,"Blue Archive is an RPG mobile title developed by NAT GAMES, Published by Nexon KR (Global) and Yostar (Japan). The player will be a teacher that leads their students into various incidents around the city.",2020-07-16,True,students,2025-05-10
nathanforyou,https://www.reddit.com/r/nathanforyou/,134755.0,"A place to post and discuss anything  and everything related to our favorite Canadian business school grad, Nathan Fielder.",2013-02-28,True,grad school,2025-05-10
UofT,https://www.reddit.com/r/UofT/,131431.0,"All things pertaining to academic, social, and cultural activities at the University of Toronto.",2009-10-29,True,grad school,2025-05-10
LawStudentsPH,https://www.reddit.com/r/LawStudentsPH/,126291.0,"The place for those who are currently enrolled in law school, and those who already passed the Bar. 

Please Read the Rules and FAQ of the Sub before posting.",2018-04-05,True,students,2025-05-10
gis,https://www.reddit.com/r/gis/,126220.0,A community dedicated to everything GIS (Geographic Information Systems).,2008-09-20,True,professional development,2025-05-10
nus,https://www.reddit.com/r/nus/,125532.0,"Welcome to the **[National University of Singapore](http://www.nus.edu.sg/)** subreddit!
Put the word out for any redditors you know out there.

Posts should be related to NUS. Exchange students/visitors are more than welcome!

Any suggestions or feedback for information to go onto the sidebar are welcome as well!

---

**Good to Know**

* **[NUS Calendar of Events](https://myaces.nus.edu.sg/CoE/)**

* [NUS EZLink Concession Information](http://",2010-01-04,True,internships,2025-05-10
EngineeringResumes,https://www.reddit.com/r/EngineeringResumes/,118896.0,A place to review and discuss engineering resumes. Please read the wiki before posting!,2015-03-31,True,internships,2025-05-10
ChemicalEngineering,https://www.reddit.com/r/ChemicalEngineering/,115619.0,All things Chemical Engineering!,2009-04-14,True,career advice,2025-05-10
Big4,https://www.reddit.com/r/Big4/,115339.0,"Welcome to r/Big4, a place to discuss everything related to the Big 4 accounting firms: PwC, Deloitte, EY, & KPMG.",2012-12-01,True,internships,2025-05-10
PhysicsStudents,https://www.reddit.com/r/PhysicsStudents/,110730.0,A place for physics students of any level to discuss the intricate profoundness of the universe.,2013-03-19,True,grad school,2025-05-10
medlabprofessionals,https://www.reddit.com/r/medlabprofessionals/,107126.0,"Medical Lab Scientists
Medical Lab Technicians
Cytogeneticists
Cytotechnologists
Histologists
Phlebotomists
Lab Processors",2013-07-15,True,new grads,2025-05-10
RemoteJobHunters,https://www.reddit.com/r/RemoteJobHunters/,105438.0,"Landing an entry-level remote role can be a long, lonely process. But with this subreddit, you will never be alone!

Here you can find entry-level remote jobs and paid internships; ask questions; and so much more.",2021-05-19,True,internships,2025-05-10
HireaWriter,https://www.reddit.com/r/HireaWriter/,104916.0, Welcome to the writer's corner! Please make sure you read the rules before posting and commenting.,2014-01-01,True,entry level jobs,2025-05-10
ABCDesis,https://www.reddit.com/r/ABCDesis/,104470.0,ABCDesis (Abroad-Born Confused Desis) is a place for members of the South Asian diaspora who were raised outside of South Asia to share their experiences and be a part of the collective global Desi diaspora community. ,2013-09-07,True,career advice,2025-05-10
PHJobs,https://www.reddit.com/r/PHJobs/,103167.0,Soon the No. 1 Job Office for the Philippines,2017-12-12,True,job hunting,2025-05-10
uwaterloo,https://www.reddit.com/r/uwaterloo/,102236.0,Unofficial student and alumni-run subreddit for the University of Waterloo community,2009-10-28,True,university,2025-05-10
MoneyDiariesACTIVE,https://www.reddit.com/r/MoneyDiariesACTIVE/,100517.0,"A friendly, supportive, inclusive, women-focused community where we share our own 7-day Money Diaries, money tips and stories, ask questions and just discuss money, life and R29 Money Diaries. Not affiliated with Refinery29.",2019-06-06,True,career advice,2025-05-10
cambridge,https://www.reddit.com/r/cambridge/,98324.0,"Cambridge, England, United Kingdom.",2008-01-28,True,coding bootcamp,2025-05-10
UniversityofReddit,https://www.reddit.com/r/UniversityofReddit/,96463.0,"Welcome to the University of Reddit, a place for redditors to learn!",2010-05-07,True,university,2025-05-10
gamemaker,https://www.reddit.com/r/gamemaker/,94908.0,"This subreddit is dedicated to providing programmer support for the game development platform, GameMaker Studio. GameMaker Studio is designed to make developing games fun and easy. Coders can take advantage of its built in scripting language, ""GML"" to design and create fully-featured, professional grade games. This subreddit is not designed for promoting your content and is instead focused on helping people make games, not promote them.",2009-04-03,True,professional development,2025-05-10
ItaliaCareerAdvice,https://www.reddit.com/r/ItaliaCareerAdvice/,92954.0,"Branch italiano del sub CareerAdvice inglese, comunità dove ci si scambia esperienze e consigli sulla propria carriera.",2021-05-06,True,career advice,2025-05-10
physicianassistant,https://www.reddit.com/r/physicianassistant/,91588.0,"Welcome to our virtual space for all things related to Physician Associates. Participation is open to anyone, including PAs, NPs, physicians, nurses, students, medical professionals, and the general public. Please review our 10 rules before contributing.

For pre-PA help, check out /r/prephysicianassistant. PA students may be interested in /r/PAstudent for discussions about PA school.",2011-10-27,True,new grads,2025-05-10
internships,https://www.reddit.com/r/internships/,89036.0,Discussions about navigating internships and co-ops. Everything about the process and experience from application to full time offer.,2010-08-15,True,internships,2025-05-10
businessanalysis,https://www.reddit.com/r/businessanalysis/,88531.0,"Welcome to the Business Analysis Hub.
Our friendly Reddit community is here to make the exciting field of business analysis accessible to everyone. 

As a member of our community, you'll enjoy:
📚 Easy-to-understand explanations of business analysis concepts, without the jargon. 
💡 Practical tips and techniques to sharpen your analytical skills. 
🌐 Engaging discussions on the latest trends and best practices in the industry. 
",2009-08-07,True,professional development,2025-05-10
CodingHelp,https://www.reddit.com/r/CodingHelp/,86018.0,**Join our discord server**: https://discord.gg/r-codinghelp-359760149683896320,2015-09-01,True,coding bootcamp,2025-05-10
scholarships,https://www.reddit.com/r/scholarships/,84632.0,"Looking for scholarships? This subreddit lists opportunities for **U.S. students** who are seeking free money for college. Come back often, as we frequently add new scholarships to our growing list of available awards.",2011-12-22,True,college students,2025-05-10
TEFL,https://www.reddit.com/r/TEFL/,82354.0,Questions and discussion about everything related to Teaching English as a Foreign Language (TEFL) around the world.,2008-12-20,True,professional development,2025-05-10
physicaltherapy,https://www.reddit.com/r/physicaltherapy/,81675.0,"If you are not a licensed PT, PTA, student counterpart or other healthcare professional please do not post here. This is a sub for practicing physical therapists to discuss cases, research, old and new tricks, or other therapy-relevant topics.  

Requests for advice or education regarding your personal health issues will be removed and you may be banned.  These questions should be discussed directly with your physical therapist.",2012-02-10,True,new grads,2025-05-10
cissp,https://www.reddit.com/r/cissp/,80524.0,"This sub is for those that are pursuing the CISSP® and those that have taken the exam and wish to provide feedback on the study methodology and materials employed.  This sub is not supported or managed by ISC2 or its affiliates.  This is an unofficial CISSP® Reddit sub.

Information about experience requirements/endorsement/CPEs can be found at https://www.isc2.org/",2011-03-30,True,professional development,2025-05-10
taxpros,https://www.reddit.com/r/taxpros/,80141.0,"A community for Redditors who are tax professionals to discuss professional development, firm procedures, news, policy, software, AICPA/IRS changes, news/updates about law relating to any tax - U.S. and International, Federal, State, or local.",2014-07-02,True,professional development,2025-05-10
rutgers,https://www.reddit.com/r/rutgers/,79326.0,"The official subreddit for Rutgers University 
 
RU RAH RAH",2010-02-18,True,coding bootcamp,2025-05-10
Veterinary,https://www.reddit.com/r/Veterinary/,73398.0,,2009-11-12,True,new grads,2025-05-10
SecurityCareerAdvice,https://www.reddit.com/r/SecurityCareerAdvice/,69379.0,"Like CSCareerQuestions, only cooler. This is a place to connect those seeking to learn with those who have walked the path before. Ask your questions about cybersecurity careers here, and mentors can choose to answer as they have time.

Ask. Mentor. Grow.",2018-12-19,True,career advice,2025-05-10
codingbootcamp,https://www.reddit.com/r/codingbootcamp/,68547.0,A subreddit dedicated to questions and discussions about coding bootcamps.,2015-02-22,True,coding bootcamp,2025-05-10
