name,url,subscribers,description,created_utc,is_active,keyword,last_updated
funny,https://www.reddit.com/r/funny/,66848808.0,Reddit's largest humor depository,2008-01-25,True,college students,2025-05-10
AskReddit,https://www.reddit.com/r/AskReddit/,55143022.0,r/AskReddit is the place to ask and answer thought-provoking questions.,2008-01-24,True,college students,2025-05-10
worldnews,https://www.reddit.com/r/worldnews/,45897835.0,"A place for major news from around the world, excluding US-internal news.",2008-01-24,True,university,2025-05-10
todayilearned,https://www.reddit.com/r/todayilearned/,40606296.0,"You learn something new every day; what did you learn today?
Submit interesting and specific facts about something that you just found out here.",2008-12-28,True,college students,2025-05-10
memes,https://www.reddit.com/r/memes/,35485182.0,"Memes!

A way of describing cultural information being shared.
An element of a culture or system of behavior that may be considered to be passed from one individual to another by nongenetic means, especially imitation.",2008-07-05,True,job hunting,2025-05-10
science,https://www.reddit.com/r/science/,34027141.0,"This community is a place to share and discuss new scientific research. Read about the latest advances in astronomy, biology, medicine, physics, social science, and more. Find and submit new publications and popular science coverage of current research.",2006-10-18,True,university,2025-05-10
pics,https://www.reddit.com/r/pics/,32541467.0,"A place for photographs, pictures, and other images.",2008-01-24,True,college students,2025-05-10
news,https://www.reddit.com/r/news/,30273317.0,The place for news articles about current events in the United States and the rest of the world. Discuss it all here.,2008-01-25,True,college students,2025-05-10
LifeProTips,https://www.reddit.com/r/LifeProTips/,22865560.0,Tips that improve your life in one way or another.,2010-10-25,True,job hunting,2025-05-10
dataisbeautiful,https://www.reddit.com/r/dataisbeautiful/,21625394.0,"DataIsBeautiful is for visualizations that effectively convey information. 
 
 Aesthetics are an important part of information visualization, but pretty pictures are not the sole aim of this subreddit.",2012-02-14,True,job hunting,2025-05-10
personalfinance,https://www.reddit.com/r/personalfinance/,20981118.0,"Learn about budgeting, saving, getting out of debt, credit, investing, and retirement planning. Join our community, read the PF Wiki, and get on top of your finances!",2009-02-08,True,college students,2025-05-10
AdviceAnimals,https://www.reddit.com/r/AdviceAnimals/,9927515.0,Reddit's Gold Mine,2010-12-07,True,college students,2025-05-10
politics,https://www.reddit.com/r/politics/,8827297.0,/r/Politics is for news and discussion about U.S. politics.,2007-08-06,True,college students,2025-05-10
soccer,https://www.reddit.com/r/soccer/,8587168.0,"The football subreddit. 

News, results, and discussion about the beautiful game.",2008-05-27,True,professional development,2025-05-10
Parenting,https://www.reddit.com/r/Parenting/,8155114.0,"/r/Parenting is the place to discuss the ins and out as well as ups and downs of child-rearing. From the early stages of pregnancy to when your teenagers are finally ready to leave the nest (even if they don't want to) we're here to help you through this crazy thing called parenting. 

You can get advice on potty training, talk about breastfeeding, discuss how to get your baby to sleep or ask if that one weird thing your kid does is normal.",2008-03-24,True,professional development,2025-05-10
programming,https://www.reddit.com/r/programming/,6775105.0,Computer Programming,2006-02-28,True,coding bootcamp,2025-05-10
Frugal,https://www.reddit.com/r/Frugal/,6571875.0,"Frugality is the mental approach we each take when considering our resource allocations. It includes time, money, convenience, and many other factors.",2008-03-03,True,college students,2025-05-10
RoastMe,https://www.reddit.com/r/RoastMe/,5868998.0,"Roasting (v.) - To humorously mock or humiliate someone with a well-timed joke, diss or comeback. (As defined by urbandictionary)

Hone your roasting skills, meet other roasters, and get yourself roasted! Everybody needs to laugh at themselves! And other people, of course!",2015-04-22,True,college students,2025-05-10
unitedkingdom,https://www.reddit.com/r/unitedkingdom/,5291578.0,"For the United Kingdom of Great Britain (England, Scotland, Wales) and Northern Ireland; News, Politics, Economics, Society, Business, Culture, discussion and anything else UK related.",2008-04-02,True,university,2025-05-10
careerguidance,https://www.reddit.com/r/careerguidance/,4693587.0,"A place to discuss career options, to ask questions and give advice!",2011-12-24,True,career advice,2025-05-10
ProgrammerHumor,https://www.reddit.com/r/ProgrammerHumor/,4478867.0,For anything funny related to programming and software development.,2012-01-22,True,coding bootcamp,2025-05-10
CFB,https://www.reddit.com/r/CFB/,4350262.0,The home of college football on reddit.,2008-09-09,True,university,2025-05-10
learnprogramming,https://www.reddit.com/r/learnprogramming/,4208519.0,A subreddit for all questions related to programming in any language.,2009-09-24,True,professional development,2025-05-10
canada,https://www.reddit.com/r/canada/,4053297.0,"Welcome to Canada’s official subreddit! This is the place to engage on all things Canada. Nous parlons en anglais et en français. Please be respectful of each other when posting, and note that users new to the subreddit might experience posting limitations until they become more active and longer members of the community. Do not hesitate to message the mods if you experience any issues!",2008-01-25,True,university,2025-05-10
compsci,https://www.reddit.com/r/compsci/,3993741.0,"Computer Science Theory and Application. We share and discuss any content that computer scientists find interesting. People from all walks of life welcome, including hackers, hobbyists, professionals, and academics.",2008-03-23,True,internships,2025-05-10
math,https://www.reddit.com/r/math/,3896611.0,"This subreddit is for discussion of mathematics. All posts and comments should be directly related to mathematics, including topics related to the practice, profession and community of mathematics.",2008-01-24,True,grad school,2025-05-10
chemistry,https://www.reddit.com/r/chemistry/,3835276.0,A community for chemists and those who love chemistry,2008-03-13,True,grad school,2025-05-10
relationships,https://www.reddit.com/r/relationships/,3583677.0,/r/Relationships is a community built around helping people and the goal of providing a platform for interpersonal relationship advice between redditors. We seek posts from users who have specific and personal relationship quandaries that other redditors can help them try to solve.,2008-07-09,True,grad school,2025-05-10
offmychest,https://www.reddit.com/r/offmychest/,3284042.0,"A mutually supportive community where deeply emotional things you can't tell people you know can be told. 

Whether it's long-standing baggage, happy thoughts, or recent trauma, posting it here may provide some relief. We'll listen, and if you want, we'll talk. 

We aim to keep this a safe space.",2009-10-23,True,job hunting,2025-05-10
teenagers,https://www.reddit.com/r/teenagers/,3169121.0,"r/teenagers is the biggest community forum run by teenagers for teenagers. Our subreddit is primarily for discussions and memes that an average teenager would enjoy to discuss about. We do not have any age-restriction in place but do keep in mind this is targeted for users between the ages of 13 to 19. 

Parents, teachers, and the like are welcomed to participate and ask any questions!",2010-02-26,True,students,2025-05-10
Philippines,https://www.reddit.com/r/Philippines/,3087376.0,The official Philippines subreddit,2008-07-04,True,coding bootcamp,2025-05-10
india,https://www.reddit.com/r/india/,3047621.0,The Official Subreddit for India,2008-01-24,True,college students,2025-05-10
webdev,https://www.reddit.com/r/webdev/,3029459.0,"A community dedicated to all things web development: both front-end and back-end. For more design-related questions, try /r/web_design.",2009-01-24,True,professional development,2025-05-10
CollegeBasketball,https://www.reddit.com/r/CollegeBasketball/,2992795.0,"Your home for College Basketball on the internet. Forever.  

Discord: https://discord.gg/redditcbb  

Twitter: https://twitter.com/redditCBB",2010-02-22,True,university,2025-05-10
atheism,https://www.reddit.com/r/atheism/,2917596.0,"Welcome to r/atheism, the web's largest atheist forum. All topics related to atheism, agnosticism and secular living are welcome.

If you wish to learn more about atheism, please begin by reading the [FAQ](https://www.reddit.com/r/atheism/wiki/faq).

If you are a theist, please be aware that proselytizing in any form is strictly prohibited.  

* Feel free to join our [Discord](https://discord.gg/gYPuj8R.",2008-01-25,True,university,2025-05-10
college,https://www.reddit.com/r/college/,2910466.0,The subreddit for discussion related to college and collegiate life.,2008-01-25,True,college students,2025-05-10
antiwork,https://www.reddit.com/r/antiwork/,2864792.0,"A subreddit for those who want to end work, are curious about ending work, want to get the most out of a work-free life, want more information on anti-work ideas and want personal help with their own jobs/work-related struggles.",2013-08-14,True,job hunting,2025-05-10
AskEngineers,https://www.reddit.com/r/AskEngineers/,2659983.0,"Engineers apply the knowledge of math & science to design and manufacture maintainable systems used to solve specific problems. AskEngineers is a forum for questions about the technologies, standards, and processes used to design & build these systems, as well as for questions about the engineering profession and its many disciplines.",2011-03-27,True,career advice,2025-05-10
javascript,https://www.reddit.com/r/javascript/,2403956.0,"Chat about javascript and javascript related projects. Yes, typescript counts. Please keep self promotion to a minimum/reasonable level.",2008-01-25,True,coding bootcamp,2025-05-10
cscareerquestions,https://www.reddit.com/r/cscareerquestions/,2251345.0,CSCareerQuestions is a community for  those who  are in  the process of entering or are already part of the computer science field. Our goal is to help navigate and share challenges of the industry and strategies to be  successful . ,2011-03-18,True,grad school,2025-05-10
AskAcademia,https://www.reddit.com/r/AskAcademia/,2070331.0,"This subreddit is for discussing academic life, and for asking questions directed towards people involved in academia, (both science and humanities).",2011-01-25,True,grad school,2025-05-10
jobs,https://www.reddit.com/r/jobs/,2050754.0,"/r/jobs is the number one community for advice relating to your career. 

Head to our discord for live support: discord.gg/4nJztvj",2008-03-25,True,career advice,2025-05-10
ADHD,https://www.reddit.com/r/ADHD/,2032767.0,"We're an inclusive, disability-oriented peer support group for people with ADHD with an emphasis on science-backed information. Share your stories, struggles, and non-medication strategies. Nearly two million users say they 'feel at home' and 'finally found a place where people understand them'.",2008-10-28,True,grad school,2025-05-10
gamedev,https://www.reddit.com/r/gamedev/,1888440.0,"The subreddit covers various game development aspects, including programming, design, writing, art, game jams, postmortems, and marketing. It serves as a hub for game creators to discuss and share their insights, experiences, and expertise in the industry.",2008-05-19,True,professional development,2025-05-10
marketing,https://www.reddit.com/r/marketing/,1838030.0,"For marketing communications + advertising industry professionals to discuss and ask questions related to marketing strategy, media planning, digital, social, search, campaigns, data science, email, user experience, content, copywriting, segmentation, attribution, data visualization, testing, optimization, and martech. Get advice, ask questions, or discuss any marketing-related topics. We are a support network for people working at brands, businesses, agencies, vendors, and academia.",2008-03-23,True,entry level jobs,2025-05-10
PersonalFinanceCanada,https://www.reddit.com/r/PersonalFinanceCanada/,1677766.0,Your one-stop shop to discuss personal finance within Canada.,2012-01-02,True,new grads,2025-05-10
Teachers,https://www.reddit.com/r/Teachers/,1629156.0,"Dedicated to open discussion about all things teaching.  Please read the rules before posting.  Mail sent directly to mods instead of modmail will be ignored.

██████████
██████████

Brand new & low karma accounts: please be aware your post may not show up and will need to be screened and manually approved.

██████████
██████████

No crossposting - Please do not link posts from r/Teachers in other subs, and do not link posts from other subs here.",2008-12-23,True,students,2025-05-10
FinancialCareers,https://www.reddit.com/r/FinancialCareers/,1593600.0,Plan your career in the wide world of finance.,2011-03-04,True,career advice,2025-05-10
AskEconomics,https://www.reddit.com/r/AskEconomics/,1363878.0,"A central repository for questions about economic theory, research, and policy.

Please read the rules before posting, as we remove all comments which break the rules. Answers must be in-depth and comprehensive, or they will be removed. Posts should be in the form of a question.",2011-03-31,True,entry level jobs,2025-05-10
Python,https://www.reddit.com/r/Python/,1354545.0,"The official Python community for Reddit! Stay up to date with the latest news, packages, and meta information relating to the Python programming language. 
---

If you have questions or are new to Python use r/LearnPython",2008-01-24,True,coding bootcamp,2025-05-10
developersIndia,https://www.reddit.com/r/developersIndia/,1320004.0,"A wholesome community made by & for software & tech folks in India.
Have a doubt? Ask it out.",2020-01-21,True,career advice,2025-05-10
ImTheMainCharacter,https://www.reddit.com/r/ImTheMainCharacter/,1275783.0,Main Character: People who act like they're the center of the world and worthy of all the attention.,2021-04-30,True,job hunting,2025-05-10
Conservative,https://www.reddit.com/r/Conservative/,1262003.0,"https://x.com/rcondiscord
https://discord.gg/conservative",2008-01-25,True,college students,2025-05-10
malaysia,https://www.reddit.com/r/malaysia/,1242922.0,A subreddit about Malaysia and all things Malaysian.,2008-01-26,True,coding bootcamp,2025-05-10
ApplyingToCollege,https://www.reddit.com/r/ApplyingToCollege/,1235561.0,"r/ApplyingToCollege is the premier forum for college admissions questions, advice, and discussions, from college essays and scholarships to college list help and application advice, career guidance, and more. A2C supports a welcoming and inclusive environment. Harassment, intimidation, and bullying are not tolerated.",2013-08-02,True,college students,2025-05-10
resumes,https://www.reddit.com/r/resumes/,1211659.0,Get help with your resume! Checkout the wiki and/or sidebar for resources and info!,2009-06-14,True,internships,2025-05-10
cybersecurity,https://www.reddit.com/r/cybersecurity/,1207056.0,"This subreddit is for technical professionals to discuss cybersecurity news, research, threats, etc.",2012-05-22,True,entry level jobs,2025-05-10
Accounting,https://www.reddit.com/r/Accounting/,1149060.0,Primarily for accountants and aspiring accountants to learn about and discuss their career choice. Advice and questions welcome.,2009-04-03,True,career advice,2025-05-10
nursing,https://www.reddit.com/r/nursing/,1059677.0,,2009-10-18,True,new grads,2025-05-10
sysadmin,https://www.reddit.com/r/sysadmin/,1045157.0,A reddit dedicated to the profession of Computer System Administration.,2008-10-21,True,career advice,2025-05-10
recruitinghell,https://www.reddit.com/r/recruitinghell/,995413.0,"Did a recruiter make you send them a resume and still fill out all the same information on their website?  Did a candidate send a cover letter that just says ""PLEASE LET ME WORK HERE""?  Tell us those stories!",2016-01-15,True,internships,2025-05-10
MLS,https://www.reddit.com/r/MLS/,965698.0,"The community for any and all levels of soccer in the United States & Canada, with an emphasis on Major League Soccer.",2009-11-03,True,professional development,2025-05-10
EngineeringStudents,https://www.reddit.com/r/EngineeringStudents/,912806.0,"This is a place for engineering students of any discipline to discuss study methods, get  homework help, get job search advice, and find a compassionate ear when you get a 40% on your midterm after studying all night.",2011-05-04,True,grad school,2025-05-10
GradSchool,https://www.reddit.com/r/GradSchool/,905811.0,"Discussion forum for current, past, and future students of any discipline completing post-graduate studies - taught or research.",2009-08-13,True,grad school,2025-05-10
Repsneakers,https://www.reddit.com/r/Repsneakers/,897647.0,The Internets Largest Replica Footwear Community ,2014-08-19,True,university,2025-05-10
LawSchool,https://www.reddit.com/r/LawSchool/,885944.0,"For current and former Law School Redditors. Ask questions, seek advice, post outlines, etc. This is NOT a forum for legal advice.",2009-10-29,True,internships,2025-05-10
indonesia,https://www.reddit.com/r/indonesia/,883210.0,"Welcome to /r/indonesia. Selamat datang di subreddit /r/indonesia.

Please follow the rules and respect others. Mohon patuhi peraturan subreddit dan hormati orang lain.",2008-08-04,True,coding bootcamp,2025-05-10
casualiama,https://www.reddit.com/r/casualiama/,878701.0,"The casual version of /r/IAmA. Anyone's welcome to host or participate in an AMA. Topics may involve anything from ordinary to extraordinary subject matter. The environment is relaxed, we just ask that you have fun!",2011-10-03,True,college students,2025-05-10
TrollXChromosomes,https://www.reddit.com/r/TrollXChromosomes/,834539.0,A subreddit for rage comics and other memes with a girly slant.,2011-03-31,True,grad school,2025-05-10
newzealand,https://www.reddit.com/r/newzealand/,783899.0,"r/NewZealand, this is New Zealand Today",2008-03-23,True,coding bootcamp,2025-05-10
AskIndia,https://www.reddit.com/r/AskIndia/,774732.0,"Welcome to r/AskIndia, the ultimate Q&A hub for curious minds in India. Connect with fellow Indians and ask away!",2010-12-28,True,career advice,2025-05-10
medicalschool,https://www.reddit.com/r/medicalschool/,759482.0,/r/medicalschool is an international community for medical students,2009-12-10,True,students,2025-05-10
findapath,https://www.reddit.com/r/findapath/,709090.0,"For those who have a hobby, passion, pursuit, or life goal that they want to make a living out of, but don't know how they can get there. We provide paths to all who request, so you can say ""I found a way!"" Be kind and supportive - no hate or judgement allowed here. Part of the Reddit Safe Community Network.
""Be curious, not judgemental."" -Walt Whitman",2013-03-26,True,career advice,2025-05-10
Seattle,https://www.reddit.com/r/Seattle/,704302.0,"The Seattle subreddit. News, current events, meetups, etc.

discord.gg/reddit-seattle",2008-02-28,True,coding bootcamp,2025-05-10
labrats,https://www.reddit.com/r/labrats/,667880.0,"Welcome to r/LabRats! A space for scientists, researchers, and lab workers to share experiment fails, lab wins, and PI woes. Do you need advice, a place to vent, or just some lab-life humor? Want to share your big successes, your awesome protocols, and tricks of the trade? Join your fellow labrats. We also have a discord server!",2011-08-21,True,grad school,2025-05-10
careeradvice,https://www.reddit.com/r/careeradvice/,659347.0,,2010-01-12,True,career advice,2025-05-10
StudentLoans,https://www.reddit.com/r/StudentLoans/,644072.0,"/r/StudentLoans: Reddit's hub for advice, articles, and general discussion about getting and repaying student loans.",2010-04-19,True,grad school,2025-05-10
japanlife,https://www.reddit.com/r/japanlife/,635479.0,"For residents of Japan only - if you do not reside in Japan you are welcome to read, but do not post or comment or you will be removed. 


Anything relevant to living or working in Japan such as lifestyle, food, style, environment, education, technology, housing, work, immigration, sport etc.


Rakuten Employees: Do not attempt to distribute your referral codes. We will treat it as spam. Tell Mikitani to take his forced marketing and shove it where the sun don't shine.",2010-01-16,True,job hunting,2025-05-10
GetEmployed,https://www.reddit.com/r/GetEmployed/,610264.0,"A place dedicated to giving and finding job-related advice, be it for resumes, job applications or career paths.",2012-06-13,True,career advice,2025-05-10
statistics,https://www.reddit.com/r/statistics/,596294.0,"/r/Statistics is going dark from June 12-14th as an act of protest against Reddit's treatment of 3rd party app developers.

_This community will not grant access requests during the protest. Please do not message asking to be added to the subreddit._",2008-03-13,True,grad school,2025-05-10
chicago,https://www.reddit.com/r/chicago/,593414.0,"Chicago, Illinois",2008-01-25,True,coding bootcamp,2025-05-10
phcareers,https://www.reddit.com/r/phcareers/,568784.0,Anything related to careers in the Philippines. Job listing not allowed.,2020-06-22,True,job hunting,2025-05-10
Austin,https://www.reddit.com/r/Austin/,529619.0,"The place for all things Austin, TX.",2008-03-24,True,coding bootcamp,2025-05-10
EDC,https://www.reddit.com/r/EDC/,523474.0,"A Reddit space where people can come together to show and discuss their various EDC items, ask questions and receive advice from fellow carriers, and generally promote the enjoyment of EDC.  You never know when you're going to need it!",2009-12-21,True,college students,2025-05-10
SandersForPresident,https://www.reddit.com/r/SandersForPresident/,503508.0,Bernie Sanders 2028,2013-12-05,True,college students,2025-05-10
Atlanta,https://www.reddit.com/r/Atlanta/,500504.0,"Official Subreddit for all things in and about Atlanta, Georgia, USA and the surrounding metropolitan area.",2008-06-11,True,coding bootcamp,2025-05-10
ITCareerQuestions,https://www.reddit.com/r/ITCareerQuestions/,493567.0,This subreddit is designed to help anyone in or interested in the IT field to ask career-related questions.,2014-02-03,True,career advice,2025-05-10
studentsph,https://www.reddit.com/r/studentsph/,486230.0,"For students from the Philippines, by students from the Philippines. 

For strand, course, admission and related questions, please post on r/CollegeAdmissionsPH.",2019-01-19,True,college students,2025-05-10
BabyBumps,https://www.reddit.com/r/BabyBumps/,482087.0,"A place for pregnant redditors, those who have been pregnant, those who wish to be in the future, and anyone who supports them. Not the place for bump or ultrasound pics, sorry!",2010-11-27,True,job hunting,2025-05-10
sales,https://www.reddit.com/r/sales/,474805.0,"Everything you need to know about sales, selling, business development, lead generation, prospecting, closing and more!  

Recommended books are linked in the menu and sidebar. Read our rules before posting or commenting.  

Selling, recruiting and blog spam will result in an immediate and permanent ban.",2008-05-29,True,career advice,2025-05-10
forhire,https://www.reddit.com/r/forhire/,467250.0,"Some redditors are skilled professionals, some redditors need skilled professionals. 


Scroll down for general information and our rules. Please read through these carefully, as breaking them can be a bannable offense.",2009-05-27,True,professional development,2025-05-10
Dallas,https://www.reddit.com/r/Dallas/,465273.0,"/r/Dallas is a home for discussion and content related to the Dallas/Fort Worth Metroplex. We strive to be a friendly and welcoming community to all of our users whether they are longtime residents of DFW, newcomers, curious redditors, or just visiting.",2008-10-17,True,coding bootcamp,2025-05-10
Denver,https://www.reddit.com/r/Denver/,437765.0,The place for all things related to the Denver metro area,2008-10-01,True,coding bootcamp,2025-05-10
AskNYC,https://www.reddit.com/r/AskNYC/,433216.0,,2012-08-10,True,coding bootcamp,2025-05-10
rant,https://www.reddit.com/r/rant/,397081.0,#**We are no longer allowing posts about politics**,2008-09-30,True,job hunting,2025-05-10
lostgeneration,https://www.reddit.com/r/lostgeneration/,381041.0,"For those who did everything our parents told us to do... now what?

---

Hello everyone! We've gone dark to protest Reddit's API changes towards third party apps.",2009-08-04,True,college students,2025-05-10
MensRights,https://www.reddit.com/r/MensRights/,367991.0,"At the most basic level, men's rights are the legal rights that are granted to men. However, any issue that pertains to men's relationship to society is also a topic suitable for this subreddit. Men's rights are influenced by the way men are perceived by others.

WARNING: Some other subs have bots that will ban you if you post or comment here.",2008-03-19,True,college students,2025-05-10
csMajors,https://www.reddit.com/r/csMajors/,362732.0,All about studying and students of computer science.,2014-10-05,True,college students,2025-05-10
OverwatchUniversity,https://www.reddit.com/r/OverwatchUniversity/,354189.0,"/r/OverwatchUniversity is a subreddit for learning about the game Overwatch. Featuring VOD reviews, guides, answers for all your questions, and more!",2016-05-10,True,university,2025-05-10
Portland,https://www.reddit.com/r/Portland/,351960.0,We specialize in moss and rain,2008-05-26,True,coding bootcamp,2025-05-10
