name,url,subscribers,description,created_utc,is_active,keyword,last_updated
nonprofit,https://www.reddit.com/r/nonprofit/,67039.0,"r/Nonprofit is a community for conversations about the opportunities and challenges you face working at or volunteering for nonprofits. This is also a place for constructive discussions about issues in the social sector, movement building, and philanthropy. 🤩 Before posting, search the sub, read the wiki, and follow the rules.",2008-08-24,True,professional development,2025-05-10
highereducation,https://www.reddit.com/r/highereducation/,62780.0,"A subreddit for News and Policy--and discussion about higher education in an increasingly difficult time. Ideal for people working in and around higher ed— or those interested in joining! 
Please Note: Students- this is the NEWS & POLICY sub. You're looking for r/gradschool",2009-06-10,True,college students,2025-05-10
udub,https://www.reddit.com/r/udub/,61982.0,The unofficial subreddit of the University of Washington,2009-10-27,True,university,2025-05-10
actuary,https://www.reddit.com/r/actuary/,61621.0,"Subreddit for actuarial professionals, students and interested (innocent) bystanders. Note that this subreddit is primarily US/CAN focused, however all countries are free to participate.",2008-11-25,True,internships,2025-05-10
deloitte,https://www.reddit.com/r/deloitte/,61344.0,"Community for people who work for Deloitte (or any of its partner firms). This is NOT an officially supported forum, and is primarily for informal discussion between employees.
",2011-06-03,True,new grads,2025-05-10
programmingcirclejerk,https://www.reddit.com/r/programmingcirclejerk/,59700.0,"Linus is wearing a blue shirt!

zomg noSQL u guise!

Apple Google Facebook NSA

I rewrote ""hello world"" in ~~Fortran~~ ~~Pascal~~ ~~C~~ ~~Perl~~ ~~Ruby~~ ~~Lisp~~ ~~Haskell~~ ~~Clojure~~ ~~NodeJS~~ ~~Go~~ ~~Rust~~ ~~Blockchain~~ AI",2012-07-15,True,coding bootcamp,2025-05-10
collegeresults,https://www.reddit.com/r/collegeresults/,58507.0,Subreddit dedicated to compiling data about undergraduate and transfer admissions. All students are encouraged to post their stats and college decisions. Current applicants are welcome to browse through past posts!,2015-10-16,True,college students,2025-05-10
slp,https://www.reddit.com/r/slp/,58500.0,"A community of Speech-Language Pathologists (SLPs), Speech Therapists (STs), Speech-Language Therapists (SLTs), Clinical Fellowship Clinicians (SLP-CFs), Speech-Language Pathology Assistants (SLPAs), graduate clinicians and students. We discuss ideas, stories, information, and give general advice through our personal experience and research. 

Please join /r/SLPGradSchool for pre-graduate school and graduate school related discussion.",2011-06-05,True,grad school,2025-05-10
Resume,https://www.reddit.com/r/Resume/,56475.0,A community where people can submit their resumes for anonymous feedback. General resume questions and discussions are welcomed as well.,2009-03-19,True,new grads,2025-05-10
foodscience,https://www.reddit.com/r/foodscience/,54753.0,"A professional place to discuss questions regarding food science and technology, as well as the greater food industry.

Join our Discord channel for more in depth discussions.

Link: https://discord.gg/x7DbTkAe9D

(For culinary or nutrition questions, visit r/AskCulinary or r/Nutrition.)",2009-01-22,True,grad school,2025-05-10
springfieldMO,https://www.reddit.com/r/springfieldMO/,54298.0,"A vibrant community for Springfield, Missouri, and the 417 area code! Whether you’re a resident, visitor, college student, or just passing through the heart of the Ozarks, join us for local news, events, discussions, and all things Springfield and the surrounding Ozarks region.",2008-05-29,True,college students,2025-05-10
nursepractitioner,https://www.reddit.com/r/nursepractitioner/,54137.0,"This is a platform designed to inform and unite the NP community. 

Asking for advice, practice information, the job market, and general banter is encouraged!",2012-10-04,True,new grads,2025-05-10
ufl,https://www.reddit.com/r/ufl/,51773.0,"This is the unofficial subreddit for the University of Florida, a public university located in Gainesville, Florida.",2010-02-24,True,university,2025-05-10
yorku,https://www.reddit.com/r/yorku/,50939.0,"The unofficial subreddit for York University, Toronto, Canada. The 3rd largest university in Canada. Also home to the Schulich School of Business and the Osgoode Hall Law School.",2010-12-20,True,university,2025-05-10
Career_Advice,https://www.reddit.com/r/Career_Advice/,50057.0,This subreddit helps redditors find their perfect career by finding out exactly what their passion is.,2012-10-03,True,career advice,2025-05-10
geologycareers,https://www.reddit.com/r/geologycareers/,49465.0,"Advice, advertisements and other topics relating to any and all jobs in geology; from paleontology to igneous petrology and the energy industry.",2013-05-09,True,grad school,2025-05-10
PennStateUniversity,https://www.reddit.com/r/PennStateUniversity/,47671.0,The reddit home of Pennsylvania State University. We Are!,2010-01-26,True,university,2025-05-10
girlsgonewired,https://www.reddit.com/r/girlsgonewired/,47478.0,Where girls get their geek on.,2012-10-04,True,coding bootcamp,2025-05-10
AccountingPH,https://www.reddit.com/r/AccountingPH/,46307.0,"Accounting Subreddit for Filipinos

Students, Reviewees and CPA professionals are welcome here.

For Students and Reviewees: Ask questions, post review materials, and share your experiences

For CPA professionals: Share your experiences, give advices, ask for help

For EVERYONE: Enjoy your stay and welcome to a material world.",2018-06-17,True,job hunting,2025-05-10
OccupationalTherapy,https://www.reddit.com/r/OccupationalTherapy/,45623.0,"This is a subreddit to celebrate all things Occupational Therapy. Whether you are an OT, know an OT, want to be an OT, or just want to hang out with some OT's, you are welcome here.",2010-12-20,True,new grads,2025-05-10
UniversityOfHouston,https://www.reddit.com/r/UniversityOfHouston/,44777.0,"A subreddit for students, alumni or fans of the University of Houston.

GO COOGS!",2010-04-23,True,university,2025-05-10
University,https://www.reddit.com/r/University/,44581.0,University. Ask questions and give answers so that everyone moves forward.,2008-11-25,True,university,2025-05-10
instructionaldesign,https://www.reddit.com/r/instructionaldesign/,43795.0,"The practice of creating ""instructional experiences which make the acquisition of knowledge and skill more efficient, effective, and appealing."" This community aims to foster inclusive discussion and collaboration between professionals from around the world. Participation is open to everyone, but our policies and moderation aim to keep the sub interesting and relevant to people who are established in their careers.",2012-10-10,True,professional development,2025-05-10
stanford,https://www.reddit.com/r/stanford/,43600.0,A subreddit for current students and alums to talk about Stanford stuff.,2009-09-21,True,college students,2025-05-10
Environmental_Careers,https://www.reddit.com/r/Environmental_Careers/,42967.0,"A place to discuss careers and professional development related to environmental sciences and engineering, including compliance, permitting, assessments, remediation, and related fields.  An emphasis is placed on career advice and job hunting.",2016-12-29,True,career advice,2025-05-10
Nurses,https://www.reddit.com/r/Nurses/,42847.0,A community for nurses.,2009-03-07,True,new grads,2025-05-10
librarians,https://www.reddit.com/r/librarians/,41649.0,"For public, academic, special, and prospective librarians discussing librarianship, library management, information science and any topic relevant to this profession.",2008-12-04,True,professional development,2025-05-10
CyberSecurityJobs,https://www.reddit.com/r/CyberSecurityJobs/,41014.0,A forum for discussing cybersecurity career information.,2016-02-14,True,entry level jobs,2025-05-10
90daysgoal,https://www.reddit.com/r/90daysgoal/,40967.0,We're changing our lives... 90 days at a time!,2010-08-11,True,professional development,2025-05-10
ExecutiveAssistants,https://www.reddit.com/r/ExecutiveAssistants/,40506.0,"This subreddit is for Executive Assistants to share resources, tips, stories, ask questions, or vent about their bosses!",2015-04-08,True,professional development,2025-05-10
DentalHygiene,https://www.reddit.com/r/DentalHygiene/,39037.0,"This sub is a place for Dental Hygienists, Dental Hygiene students, and the general public to ask questions and comment about dental hygiene. Dental hygiene is a broad topic so we are pretty lenient on topics. Please read the rules for clarity. All posts must be approved by a mod before they will show up so be patient with us.  
Don't forget to floss your teeth!",2011-09-01,True,new grads,2025-05-10
UKUniversityStudents,https://www.reddit.com/r/UKUniversityStudents/,38564.0,"This sub is about discussing  Uni life in the UK. Share your views, seek advice on study, careers, and get help from fellow students and staff. ",2014-11-25,True,students,2025-05-10
Hermeticism,https://www.reddit.com/r/Hermeticism/,38109.0,"This subreddit is a community for the discussion of Classical Hermeticism, a religious, philosophical, and esoteric tradition based primarily upon writings attributed to Hermes Trismegistus (""thrice-greatest Hermes"").",2013-03-03,True,entry level jobs,2025-05-10
CRNA,https://www.reddit.com/r/CRNA/,35908.0,A place to discuss Nurse Anesthesia.,2013-03-03,True,new grads,2025-05-10
austinjobs,https://www.reddit.com/r/austinjobs/,35867.0,,2011-05-27,True,job hunting,2025-05-10
IOPsychology,https://www.reddit.com/r/IOPsychology/,35452.0,"/r/iopsychology is dedicated to all things IO psychology. As a highly interdisciplinary field, we promote research and practice in IO domains as well as areas of communication, knowledge management, business, sociology, economics, and MIS.


Topics to consider for discussion include, but are not limited to, HRM (e.g., selection, training, recruitment), OB (e.g., leadership, OHP, creativity), Psychometrics, as well as new or emerging subdomains of IO.",2011-06-23,True,grad school,2025-05-10
Careers,https://www.reddit.com/r/Careers/,35282.0,"A community for career discussion, questions and advice.",2009-02-27,True,career advice,2025-05-10
OpenUniversity,https://www.reddit.com/r/OpenUniversity/,34759.0,"An unofficial subreddit for students, staff and anyone interested in the UK's Open University to discuss matters relating to the OU.",2011-01-16,True,university,2025-05-10
NursingStudents,https://www.reddit.com/r/NursingStudents/,34248.0,Closed. Go to /r/StudentNurse,2012-04-18,True,students,2025-05-10
mit,https://www.reddit.com/r/mit/,34112.0,"This sub is a community for students, faculty, staff, and alumni of the Massachusetts Institute of Technology to discuss all aspects of MIT. There is a  separate sub for admissions questions: r/MITAdmissions.",2008-01-25,True,college students,2025-05-10
Internationalteachers,https://www.reddit.com/r/Internationalteachers/,33914.0,"This is a subreddit created for certified and qualified teachers* who teach in international schools - wherever they may be. This is a place to share information and discuss issues related to teaching in international schools. 

**Qualified teachers: possess a minimum of a bachelor's degree and a teaching certification. 

Newbies to the career should read the wiki or join us in the Newbie Question thread recurring every Monday. Questions that are already addressed in the wiki will be deleted.",2015-03-22,True,professional development,2025-05-10
dietetics,https://www.reddit.com/r/dietetics/,30942.0,A place for current and future nutrition professionals to discuss all aspects of the profession.,2012-03-26,True,internships,2025-05-10
academiceconomics,https://www.reddit.com/r/academiceconomics/,29308.0,Unofficial discord: https://discord.gg/4qEc2yp,2009-09-08,True,grad school,2025-05-10
ELATeachers,https://www.reddit.com/r/ELATeachers/,28242.0,A place for English teachers to share ideas and lessons and to brainstorm and collaborate on all things related to English Language Arts.,2012-12-24,True,professional development,2025-05-10
cscareerquestionsCAD,https://www.reddit.com/r/cscareerquestionsCAD/,27963.0,A subreddit for those with questions about working in the tech industry or in a CS/dev/programmer related job specifically in Canada.,2021-03-07,True,new grads,2025-05-10
UniversityTR,https://www.reddit.com/r/UniversityTR/,26536.0,"Reddit Türkiye'nin en aktif ve en büyük Üniversiteliler sayfası. Yalnızca Türkçe ve İngilizce gönderiler kabul edilir.

| Turkey's largest and most active university subreddit. Both Turkish and English posts are welcome. ",2023-08-21,True,university,2025-05-10
veterinaryprofession,https://www.reddit.com/r/veterinaryprofession/,26448.0,"This is a forum for people currently in the veterinary profession or looking to go into the profession to discuss anything related to the veterinary industry such as vet school and entry to vet school, career advice, veterinary related news, difficulties in the veterinary profession, or just discussing the annoying/interesting part of your day.",2016-07-25,True,new grads,2025-05-10
TransferStudents,https://www.reddit.com/r/TransferStudents/,25585.0,A place for conversations about the experience of transferring between colleges and other institutions for higher education.,2018-05-23,True,college students,2025-05-10
respiratorytherapy,https://www.reddit.com/r/respiratorytherapy/,25239.0,"All things RT: Articles, stories, etc.",2012-10-25,True,new grads,2025-05-10
IndianaUniversity,https://www.reddit.com/r/IndianaUniversity/,24140.0,**Proud home of Reddit's best University and Hoosiers.**,2011-04-13,True,university,2025-05-10
InternationalStudents,https://www.reddit.com/r/InternationalStudents/,23086.0,"This is a community for international students to talk about studying in the USA or anywhere else. It can be about anything from getting scholarships, visas, getting internships and jobs, culture, etc.",2016-08-09,True,students,2025-05-10
PAstudent,https://www.reddit.com/r/PAstudent/,21801.0,"This is a subreddit for PA students who are looking for general support, as well as lifestyle and study tips.",2016-11-17,True,new grads,2025-05-10
slpGradSchool,https://www.reddit.com/r/slpGradSchool/,21481.0,"This subreddit has been created specifically for speech-language pathology students to converse about the graduate school application process and for current and former students to discuss, anonymously, everything and anything surrounding the world of SLP schooling. ",2015-09-14,True,grad school,2025-05-10
ProWordPress,https://www.reddit.com/r/ProWordPress/,21291.0,"A sub for Professional WordPress developers to ask advanced questions, problem solving, code snippets, workflow methods, and developer focused talks. Do not spam links! Please use r/WordPress for basic/entry level help. Basic posts, plugin spam, etc will be removed.",2013-01-04,True,entry level jobs,2025-05-10
StartupAccelerators,https://www.reddit.com/r/StartupAccelerators/,20254.0,"Community for everyone who is interested in joining a startup accelerator program, has graduated from one, or has insight into the experience. 

For accelerator program advocates, graduates, and MDs to share accelerator program insights and answers to those who need them!
Ask questions, get answers, SHARE your stories!!!",2014-06-11,True,new grads,2025-05-10
CUNY,https://www.reddit.com/r/CUNY/,20240.0,An online Meet-up for CUNY students to discuss what ever it is you wish to discuss!,2011-05-16,True,college students,2025-05-10
TechCareerShifter,https://www.reddit.com/r/TechCareerShifter/,20044.0,"Welcome to Tech Career Shifter Philippines! We are a community of Filipino career shifters and self-learners who support each other's transition into the tech industry. It is open to everyone aspiring to be a Tech Professional: self-learners, IT/CS students and fresh graduates, and career-shifters alike.",2022-03-05,True,coding bootcamp,2025-05-10
jobsearch,https://www.reddit.com/r/jobsearch/,19262.0,"The subreddit for discussing job hunting strategies and tips, hacks, or anything related to career advancement. If you are tired of seeing ads targeting job seekers, you can come here for a change.",2008-09-30,True,job hunting,2025-05-10
cscareers,https://www.reddit.com/r/cscareers/,18039.0,"For discussion of computer science careers, software development, software engineering. All discussions about CS careers are encouraged not just those beneficial to recruiters and interviewers. Sharing job-finding information, tips/tricks is welcome. Part of the Reddit Safe Community Network.",2015-12-21,True,college students,2025-05-10
Sonographers,https://www.reddit.com/r/Sonographers/,17534.0,"A professional, tech-oriented space for all diagnostic sonographers to share interesting cases, patient stories, CME info, ask questions about education, schooling, vent about job situations, etc. 
Current sonography students & technologists are welcome to post. Career questions are welcome in the weekly thread.  

Laypeople are welcome to use r/radiology or r/ultrasound. 

Please familiarize yourself with the sub rules prior to posting.",2019-01-26,True,new grads,2025-05-10
duke,https://www.reddit.com/r/duke/,17265.0,"Welcome to the Duke University subreddit! Here you can find discussion of anything Duke-related - sports, academics, activities, anything! Tell your friends!",2010-02-02,True,university,2025-05-10
NetworkingJobs,https://www.reddit.com/r/NetworkingJobs/,15269.0,,2012-04-11,True,job hunting,2025-05-10
MedicalPhysics,https://www.reddit.com/r/MedicalPhysics/,15017.0,A place to discuss all things related to Medical Physics,2012-01-23,True,grad school,2025-05-10
PHXList,https://www.reddit.com/r/PHXList/,14716.0,"Phoenix area place for Craigslist/classified ad posts to sell items, look for housing, find a job, report lost pets, find services, and more.",2015-11-02,True,job hunting,2025-05-10
jobhunting,https://www.reddit.com/r/jobhunting/,14260.0,"Welcome to  💼 JobHunting (part of r/RemoteWorkSource )!  This sub is for professional job leads, resume/cover tips, interview advice, and more. **DO NOT SPAM THIS BOARD WITH AFFILIATE JOB LINKS, ARTICLES LINKED TO YOUR FEE-BASED SITES, OR OTHER GARBAGE. ** [Recruiters welcome to post, providing company, name, and email is given.] This sub is run by www.careerpowerup.com.",2013-09-11,True,job hunting,2025-05-10
HuntingGrounds,https://www.reddit.com/r/HuntingGrounds/,13414.0,"Predator: Hunting Grounds is an asymmetrical multiplayer shooter available on Xbox, PlayStation, and PC; developed and published by IllFonic in collaboration with 20th Century Fox.",2019-05-09,True,job hunting,2025-05-10
PMHNP,https://www.reddit.com/r/PMHNP/,12972.0,A place for PMHNPs and others interested in mental health.,2016-04-20,True,new grads,2025-05-10
theNXIVMcase,https://www.reddit.com/r/theNXIVMcase/,11943.0,"Discussing NXIVM, the New York Capital Region-based group that sold expensive  seminars of dubious value. The group was founded by so-called ""Vanguard"" Keith Raniere. 

The organization is commonly called a ""cult,"" and has been termed a ""racketeering enterprise"" by the U.S. government. 

Keith Raniere is today a convicted felon serving a 120-year sentence.",2020-08-23,True,professional development,2025-05-10
managementconsulting,https://www.reddit.com/r/managementconsulting/,11573.0,"A community for management consultants and those who are interested in management consulting. Discuss careers, recruiting, exit opportunities and personal/professional development. Be kind.",2015-07-20,True,professional development,2025-05-10
NursingAU,https://www.reddit.com/r/NursingAU/,11482.0,"A subreddit for nurses, nursing students and clinicians in Australia.",2023-01-10,True,new grads,2025-05-10
gradschoolmemes,https://www.reddit.com/r/gradschoolmemes/,11005.0,"A subreddit for memes relating to grad school, life as a graduate student, etc.",2013-10-27,True,grad school,2025-05-10
GraduateSchool,https://www.reddit.com/r/GraduateSchool/,10355.0,"Discussion forum for current, past, and future students of any discipline completing post-graduate studies - taught or research.",2008-07-08,True,grad school,2025-05-10
dartmouth,https://www.reddit.com/r/dartmouth/,10110.0,"The subreddit for Dartmouth College, the Ivy League school located in Hanover, NH.",2009-11-09,True,college students,2025-05-10
SkillBridge,https://www.reddit.com/r/SkillBridge/,9881.0,Helping transitioning service members find opportunities to participate in training and industry internships within the last 180 days of service.,2021-05-19,True,internships,2025-05-10
OSUOnlineCS,https://www.reddit.com/r/OSUOnlineCS/,9688.0,"A subreddit for students of the Oregon State Online Computer Science BS post-bacc program. Find yourself another classmate, get help, or ask questions :)",2014-11-19,True,coding bootcamp,2025-05-10
SocialWorkStudents,https://www.reddit.com/r/SocialWorkStudents/,9314.0,"This sub is dedicated to students and educators in the field of Social Work. This is a place for us to connect, discuss, get advice and homework help, and develop into our profession. We work to improve the field of Social Work as is within our ethics as professionals.",2019-10-03,True,students,2025-05-10
journalismjobs,https://www.reddit.com/r/journalismjobs/,9295.0,A place to post journalism jobs.,2012-12-14,True,internships,2025-05-10
LawStudentsCanada,https://www.reddit.com/r/LawStudentsCanada/,9192.0,"A place to discuss the Canadian law school application process, law school, and the legal profession.

We also have a Discord server where we talk about law school admissions, the LSAT, beyond law school, and the law generally.",2021-05-29,True,students,2025-05-10
UofB,https://www.reddit.com/r/UofB/,9117.0,"The official subreddit for students, staff and alumni of The University of Birmingham, UK.",2011-09-28,True,university,2025-05-10
GradSchoolAdvice,https://www.reddit.com/r/GradSchoolAdvice/,9046.0,For newer grad students or anyone seeking advice and support regarding grad school. Come on down and ask away.,2015-01-17,True,grad school,2025-05-10
ChristUniversity,https://www.reddit.com/r/ChristUniversity/,8645.0,"Welcome to r/ChristUniversity – the unofficial hub for all things Christ University. Whether you're a current student, alumni, aspirant, or just curious, this is your space to discuss academics, campus life, clubs, fests, placements, hostels, and more. Share your experiences, ask questions, find notes, post memes (in the right thread), and build your Christite network. Let’s keep it respectful, helpful, and fun!",2016-07-15,True,university,2025-05-10
CareerAdvicePH,https://www.reddit.com/r/CareerAdvicePH/,7718.0,"A subreddit focused on providing advice and resources for job seekers and those looking to advance their careers, with discussions on topics such as networking, resumes, and interviews in the Philippines.",2021-11-29,True,career advice,2025-05-10
Students,https://www.reddit.com/r/Students/,7542.0,,2009-05-10,True,students,2025-05-10
SakuraGakuin,https://www.reddit.com/r/SakuraGakuin/,7110.0,A subreddit dedicated to the Japanese pop group Sakura Gakuin and all of their associated sub-groups.,2014-05-04,True,students,2025-05-10
BostonUniversity,https://www.reddit.com/r/BostonUniversity/,6514.0,A Reddit community for all terriers or interested applicants to discuss everything BU!,2011-07-18,True,university,2025-05-10
teflteachers,https://www.reddit.com/r/teflteachers/,5560.0,A subreddit for discussion lesson planning and other activities in our TEFL classrooms and other TEFL teaching related activities. No Job hunting allowed.,2013-01-02,True,job hunting,2025-05-10
ilstu,https://www.reddit.com/r/ilstu/,5269.0,The UNOFFICIAL subreddit of Illinois State University.,2010-11-01,True,university,2025-05-10
UniversityofFlorida,https://www.reddit.com/r/UniversityofFlorida/,5030.0,,2010-09-20,True,university,2025-05-10
statecollege,https://www.reddit.com/r/statecollege/,4944.0,"A subreddit for the citizens of State College, and the Students at Penn State. ",2010-03-15,True,college students,2025-05-10
newgradnurse,https://www.reddit.com/r/newgradnurse/,4837.0,"Welcome to the 'New Grad Nurse' Subreddit!

This is a dedicated space for new graduate nurses to come together, share experiences, ask for advice, and support each other as we navigate the early stages of our nursing careers. Whether you’re seeking guidance on clinical skills, dealing with the challenges of balancing work and personal life, or simply looking to connect with others who understand what you’re going through, you’re in the right place.",2022-02-16,True,new grads,2025-05-10
ThaparUniversity,https://www.reddit.com/r/ThaparUniversity/,4633.0,"The subreddit for the students of Thapar University, Patiala. ",2022-01-19,True,university,2025-05-10
ohiouniversity,https://www.reddit.com/r/ohiouniversity/,4596.0,Welcome to Ohio University,2010-01-13,True,university,2025-05-10
AmericanU,https://www.reddit.com/r/AmericanU/,4167.0,"The community-ran subreddit of American University in Washington, DC. Open to students; current, future and former. Operated in tandem with the American University Discord server, and AU Steam group.",2011-07-07,True,university,2025-05-10
Durhamu,https://www.reddit.com/r/Durhamu/,3887.0,"Your unofficial hub for all things Durham Uni! From collegiate drama to midnight library sessions, pub crawls to formal dinners - we've got the lot. Share your Durham moments, ask about accommodation, or just come for a virtual cuppa. Whether you're a fresher finding your feet or a postgrad buried in research, this is your space to connect. Bonus points if you've ever gotten lost in Palace Green!",2011-05-20,True,university,2025-05-10
