name,url,subscribers,description,created_utc,is_active,keyword,last_updated
Medical_Students,https://www.reddit.com/r/Medical_Students/,3724.0,The best community of medical students. Join with Online community for Medical students & Doctors where you can join various medico all over the world.,2017-04-07,True,students,2025-05-10
gradschoolph,https://www.reddit.com/r/gradschoolph/,3648.0,,2022-08-26,True,grad school,2025-05-10
AIJobsBoard,https://www.reddit.com/r/AIJobsBoard/,3283.0,"Welcome to EasyJob AI – your go-to AI job board.

We’ve got a wide range of AI, ML, Data Science, and Generative AI roles,plus exclusive opportunities at innovative AI startups you won’t find elsewhere.

This is a place to share, learn, and help shape the future of AI job hunting. Got feedback or feature ideas? Drop them here—we’re building this together. Let’s make something great.",2025-02-18,True,job hunting,2025-05-10
forageStudents,https://www.reddit.com/r/forageStudents/,2757.0,Students of the Forage Virtual Work Experience Platform (theforage.com),2021-02-09,True,students,2025-05-10
PaidInternships,https://www.reddit.com/r/PaidInternships/,2472.0,"r/PaidInternships is for PAID ONLY college/university internships, asking school-related questions, offering advice, or sharing anything related to college.  Our hashtag #PayTheIntern.",2020-03-05,True,internships,2025-05-10
UKLawStudents,https://www.reddit.com/r/UKLawStudents/,2413.0,"This Subreddit is for all students studying, thinking about studying, or hoping to study Law in the UK.  The Subreddit /r/lawschool has a very American driven content, so this is for anyone who lives in the UK and wants to enjoy the same level of community that /r/lawschool gives the American students.",2015-07-28,True,students,2025-05-10
SonographyStudents,https://www.reddit.com/r/SonographyStudents/,2242.0,"A place where sonography students can vent, ask questions, discuss topics with fellow students, post their accomplishments, all things medical sonography.",2021-08-15,True,students,2025-05-10
WriteIvy,https://www.reddit.com/r/WriteIvy/,1874.0,"Step-by-step formulas for writing graduate SOPs that fill you with confidence, flood your inbox with admission offers, and launch your career as a high-achieving scholar.",2022-04-28,True,grad school,2025-05-10
CentennialCollege,https://www.reddit.com/r/CentennialCollege/,1717.0,A sub-reddit for Centennial College Students of Ontario. (Not officially affiliated),2012-02-02,True,college students,2025-05-10
NIOS_Students,https://www.reddit.com/r/NIOS_Students/,1702.0,"Welcome to r/NIOS_Students! This subreddit serves as a platform for NIOS students to connect, share information, seek advice, and support each other. Whether you're looking for enrollment guidance, study tips, or assistance with NIOS-related issues, this community is here to help.

**This is not an official subreddit of NIOS, it is maintained by students**",2024-03-03,True,students,2025-05-10
cscareeradvice,https://www.reddit.com/r/cscareeradvice/,1511.0,,2016-05-15,True,career advice,2025-05-10
UniversityMaastricht,https://www.reddit.com/r/UniversityMaastricht/,1486.0,"This is a subreddit for all your questions or stories about the University of Maastricht.

Created on March 3rd, 2024

Rules:
- No spam
- No NSFW
- No bullying
- No trolling
- English or Dutch language desired


Requirements to post:
None, you can post if you are interested in the university or if you have questions for other students. 

Note: This sub is not an official Maastricht University subreddit. It's a sub to help each other out, nothing more than that. 

",2024-03-03,True,university,2025-05-10
gradadmissions_intl,https://www.reddit.com/r/gradadmissions_intl/,1390.0,"This subreddit is for anyone who is going through the process of getting into graduate school outside the US, and for those who've been there and have advice to give.",2020-09-20,True,grad school,2025-05-10
EngineeringGradSchool,https://www.reddit.com/r/EngineeringGradSchool/,1335.0,"A subreddit dedicated to those who are pursuing or have received a Master of Science, a Master of Engineering, or a Doctor of Philosophy in an Engineering discipline.

This sub seeks to provide a place where graduate students in Engineering can ask questions and receive answers from others in similar disciplines, which can be difficult in more broad subreddits.",2014-08-31,True,grad school,2025-05-10
resumetailoring,https://www.reddit.com/r/resumetailoring/,1239.0,Helping others tailor the resume for a specific job description as this is the most important aspect of the job hunting. Unfortunately it's also the most time consuming. After successfully landing an interview with a tailored resume we will post before and after posts. Reach out to me if you need help with tailoring.,2024-08-27,True,job hunting,2025-05-10
